{
  "format": "jobhound-company",
  "schema_version": 1,
  "id": "volvo-group",
  "name": "Volvo Group",
  "aliases": [],
  "website_url": "https://www.volvogroup.com/",
  "logo_url": null,
  "facets": {
    "industries": [
      "automotive"
    ],
    "specialties": [
      "vehicle-manufacturing"
    ],
    "tags": [
      "Car Industry",
      "Automakers"
    ]
  }
}
