{
  "format": "jobhound-company",
  "schema_version": 1,
  "id": "capreit",
  "name": "CAPREIT",
  "aliases": [],
  "website_url": "https://capreit.ca",
  "logo_url": "https://www.capreit.ca/wp-content/uploads/2021/11/cropped-cropped-Capreit_Icon_Indigo_RGB_600px@72ppi-32x32.png",
  "facets": {
    "industries": [],
    "specialties": [],
    "tags": [
      "Canada",
      "Canadian hiring expansion"
    ]
  }
}
