{
  "format": "jobhound-company",
  "schema_version": 1,
  "id": "macdon-industries",
  "name": "MacDon Industries",
  "aliases": [
    "MacDon"
  ],
  "website_url": "https://macdon.com/",
  "logo_url": null,
  "facets": {
    "industries": [
      "manufacturing"
    ],
    "specialties": [],
    "tags": [
      "Complete board listings",
      "October 2026 expansion"
    ]
  }
}
