{
  "format": "jobhound-company",
  "schema_version": 1,
  "id": "fenplast",
  "name": "Fenplast",
  "aliases": [
    "Fenplast"
  ],
  "website_url": "https://fenplast.com/",
  "logo_url": null,
  "facets": {
    "industries": [
      "manufacturing"
    ],
    "specialties": [],
    "tags": [
      "Complete public boards",
      "October 2026 expansion"
    ]
  }
}
