{
  "format": "jobhound-company",
  "schema_version": 1,
  "id": "cabco",
  "name": "Cabco Technologies",
  "legal_name": null,
  "aliases": [],
  "website_url": "https://www.cabco.ca/",
  "logo_url": null,
  "facets": {
    "industries": [
      "telecommunications"
    ],
    "specialties": [],
    "tags": [
      "Canada",
      "October 2026 expansion"
    ]
  }
}
