{
  "format": "jobhound-company",
  "schema_version": 1,
  "id": "fonderie-lemoltech",
  "name": "Fonderie Lemoltech",
  "aliases": [
    "Lemoltech"
  ],
  "website_url": "https://lemoltech.com/",
  "logo_url": null,
  "facets": {
    "industries": [
      "manufacturing"
    ],
    "specialties": [],
    "tags": [
      "Complete public boards",
      "October 2026 expansion"
    ]
  }
}
