{
  "format": "jobhound-company",
  "schema_version": 1,
  "id": "pgs-experts-inc-et-pgs-industriel-inc",
  "name": "PGS Experts inc. et PGS Industriel inc.",
  "aliases": [
    "PGS Experts inc. et PGS Industriel",
    "Groupe PGS",
    "PGS Experts",
    "PGS Industriel"
  ],
  "website_url": "https://www.jobillico.com/voir-entreprise/pgs-experts-inc-et-pgs-industriel-inc",
  "logo_url": null,
  "facets": {
    "industries": [],
    "specialties": [],
    "tags": [
      "Complete public boards",
      "October 2026 expansion"
    ]
  }
}
