{
  "format": "jobhound-company",
  "schema_version": 1,
  "id": "speak",
  "name": "Speak",
  "legal_name": null,
  "aliases": [],
  "website_url": "https://www.speak.com/",
  "logo_url": null,
  "facets": {
    "industries": [
      "technology"
    ],
    "specialties": [
      "artificial-intelligence"
    ],
    "tags": [
      "AI",
      "Technology",
      "Global"
    ]
  }
}
