{
  "format": "jobhound-company",
  "schema_version": 1,
  "id": "structures-rbr",
  "name": "Structures RBR",
  "legal_name": null,
  "aliases": [],
  "website_url": "https://structuresrbr.ca/",
  "logo_url": null,
  "facets": {
    "industries": [
      "building-products"
    ],
    "specialties": [],
    "tags": [
      "Canada",
      "October 2026 expansion"
    ]
  }
}
