{
  "format": "jobhound-company",
  "schema_version": 1,
  "id": "gsdm",
  "name": "GSD&M",
  "legal_name": null,
  "aliases": [],
  "website_url": "https://www.gsdm.com/",
  "logo_url": null,
  "facets": {
    "industries": [
      "marketing"
    ],
    "specialties": [],
    "tags": [
      "Marketing",
      "Agencies",
      "Global"
    ]
  }
}
