{
  "format": "jobhound-company",
  "schema_version": 1,
  "id": "resilience",
  "name": "Resilience",
  "aliases": [],
  "website_url": "https://resilience.com",
  "logo_url": "https://resilience.com/hubfs/resilience-favicon.png",
  "facets": {
    "industries": [],
    "specialties": [],
    "tags": [
      "Canada",
      "Canadian hiring expansion"
    ]
  }
}
