{
  "format": "jobhound-company",
  "schema_version": 1,
  "id": "hardy-construction",
  "name": "Hardy Construction",
  "aliases": [
    "Hardy Construction"
  ],
  "website_url": "https://www.hardy-construction.ca/",
  "logo_url": null,
  "facets": {
    "industries": [],
    "specialties": [],
    "tags": [
      "Complete public boards",
      "October 2026 expansion"
    ]
  }
}
