{
  "format": "jobhound-company",
  "schema_version": 1,
  "id": "okta",
  "name": "Okta",
  "aliases": [],
  "website_url": "https://okta.com",
  "logo_url": "https://www.okta.com/favicon.ico",
  "facets": {
    "industries": [],
    "specialties": [],
    "tags": [
      "Canada",
      "Canadian hiring expansion"
    ]
  }
}
